{
  "schema_version": "1.0",
  "reviewer": "Codex-Independent-PM",
  "operator": "Codex-Research-Operator",
  "reviewed_at": "2026-10-15T19:07:06.4922794+00:00",
  "snapshot_date": "2026-10-15",
  "candidate_sha256": "f004ff898c90b55a2de0fca82e5ea8ef25e9a56319c87e6050fb6595f4f47eea",
  "verdict": "APPROVED",
  "executive_summary": "Round 02 independently approved against the exact frozen SHA. All three prior majors are resolved: uncaptured TSMC claims removed everywhere, AI financing causality qualified, and rates checkpoints explicitly distinguish higher-yield thesis confirmation from long-TLT outcomes. The generic energy CPI checkpoint is removed. The 24 horizon returns, 12 excess fields, 24 event returns, 206 chart points and seven market-strip observations remain identical to the independently recalculated first round. Current PPI news is separated from October 14 completed equity closes. All six checks pass; zero structural flags and zero unresolved critical/major findings. Source access and institutional-coverage limitations are disclosed and no missing facts are invented.",
  "checks": {
    "excess_math": "pass",
    "timing_source": "pass",
    "freshness": "pass",
    "readability": "pass",
    "theme_noise": "pass",
    "proxy_tradability": "pass"
  },
  "findings": [],
  "flags_dispositioned": []
}
