{"candidate_sha256": "e8469690a582942ea28aef8095ec5ae1e96cc42c294a04b10b7e31b40c043b59", "checks": {"excess_math": "pass", "freshness": "pass", "proxy_tradability": "pass", "readability": "pass", "theme_noise": "pass", "timing_source": "pass"}, "executive_summary": "W41 bundle (4 themes, snapshot 2026-10-05): recomputed all 1W/1M/YTD returns and excess vs Sep 28 / Sep 4-adj / Dec-30-adj closes from Yahoo Finance — exact; verified benchmark strip (SPX 7773.95, NDX 31076.44, TSX 35518.55, 10Y 5.31%, USD/CAD 1.4250, WTI 89.30, gold 4167.60) and all event URLs/timestamps against Reuters/WSJ/AP/OPEC sources; zero structural flags to disposition.", "findings": [], "flags_dispositioned": [], "operator": "theme-writer", "reviewed_at": "2026-10-05T17:25:36-04:00", "reviewer": "theme-reviewer", "schema_version": "1.0", "snapshot_date": "2026-10-05", "verdict": "APPROVED"}